{
  "schema_version": "0.1",
  "view_id": "ko.view.mk7.mathematics-v0.1-golden-reference",
  "view_version": "0.1",
  "view_type": "mk7",
  "mathematics_version": "Mathematics V0.1",
  "source_curriculum_id": "ko.curriculum.mathematics-v0.1",
  "records": [
    {
      "record_id": "ko.mk7.v0.1.definition.algebra.linear-algebra.vector-spaces-linear-maps",
      "record_type": "definition",
      "prompt": "What is Vector Spaces and Linear Maps, and how is its boundary distinguished from neighboring mathematical areas?",
      "response": "The study of vector spaces, subspaces, bases, dimension, linear maps, kernels, images, and canonical linear constructions. Includes: Vector spaces; Linear transformations; Dimension and rank. Excludes: Nonlinear maps as the primary object. Boundary: Include statements about vector spaces, subspaces, bases, dimension, and linear maps; route matrix-specific canonical-form work to Matrix Theory.",
      "language": "en",
      "source_node_ids": [
        "ko.math.v0.1.algebra.linear-algebra.vector-spaces-linear-maps"
      ],
      "atomic_discipline_ids": [
        "ko.math.v0.1.ad.algebra.linear-algebra.vector-spaces-linear-maps"
      ],
      "parent_path_ids": [
        "ko.math.v0.1.math",
        "ko.math.v0.1.algebra",
        "ko.math.v0.1.algebra.linear-algebra",
        "ko.math.v0.1.algebra.linear-algebra.vector-spaces-linear-maps"
      ],
      "split": "development",
      "review_state": "machine_validated",
      "claim_ids": [
        "claim.math.v0.1.algebra.linear-algebra.vector-spaces-linear-maps.definition"
      ],
      "review_notes": [
        "Derived from the machine-validated atomic discipline boundary; human semantic review remains required."
      ]
    },
    {
      "record_id": "ko.mk7.v0.1.definition.algebra.linear-algebra.matrix-theory",
      "record_type": "definition",
      "prompt": "What is Matrix Theory, and how is its boundary distinguished from neighboring mathematical areas?",
      "response": "The study of matrices, determinants, canonical forms, eigenstructure, matrix decompositions, and matrix invariants. Includes: Matrix operations; Eigenvalues and eigenvectors; Canonical forms. Excludes: Numerical linear algebra software engineering. Boundary: Include matrix invariants and canonical forms; route abstract linear-map statements without matrix representation to Vector Spaces and Linear Maps.",
      "language": "en",
      "source_node_ids": [
        "ko.math.v0.1.algebra.linear-algebra.matrix-theory"
      ],
      "atomic_discipline_ids": [
        "ko.math.v0.1.ad.algebra.linear-algebra.matrix-theory"
      ],
      "parent_path_ids": [
        "ko.math.v0.1.math",
        "ko.math.v0.1.algebra",
        "ko.math.v0.1.algebra.linear-algebra",
        "ko.math.v0.1.algebra.linear-algebra.matrix-theory"
      ],
      "split": "development",
      "review_state": "machine_validated",
      "claim_ids": [
        "claim.math.v0.1.algebra.linear-algebra.matrix-theory.definition"
      ],
      "review_notes": [
        "Derived from the machine-validated atomic discipline boundary; human semantic review remains required."
      ]
    },
    {
      "record_id": "ko.mk7.v0.1.definition.algebra.linear-algebra.linear-systems",
      "record_type": "definition",
      "prompt": "What is Linear Systems, and how is its boundary distinguished from neighboring mathematical areas?",
      "response": "The study of existence, uniqueness, structure, and solution methods for systems of linear equations and related operator equations. Includes: Linear equations; Rank and solvability; Solution spaces. Excludes: Nonlinear differential equation solving. Boundary: Include linear equation systems and their solution spaces; exclude nonlinear systems and numerical implementation details.",
      "language": "en",
      "source_node_ids": [
        "ko.math.v0.1.algebra.linear-algebra.linear-systems"
      ],
      "atomic_discipline_ids": [
        "ko.math.v0.1.ad.algebra.linear-algebra.linear-systems"
      ],
      "parent_path_ids": [
        "ko.math.v0.1.math",
        "ko.math.v0.1.algebra",
        "ko.math.v0.1.algebra.linear-algebra",
        "ko.math.v0.1.algebra.linear-algebra.linear-systems"
      ],
      "split": "development",
      "review_state": "machine_validated",
      "claim_ids": [
        "claim.math.v0.1.algebra.linear-algebra.linear-systems.definition"
      ],
      "review_notes": [
        "Derived from the machine-validated atomic discipline boundary; human semantic review remains required."
      ]
    },
    {
      "record_id": "ko.mk7.v0.1.definition.algebra.number-theory.elementary-number-theory",
      "record_type": "definition",
      "prompt": "What is Elementary Number Theory, and how is its boundary distinguished from neighboring mathematical areas?",
      "response": "The study of divisibility, congruences, primes, arithmetic functions, and integer properties using elementary or classical methods. Includes: Divisibility; Congruences; Prime numbers. Excludes: Number fields as the primary framework. Boundary: Include integer divisibility, congruence, and primes; route number fields and ideals to Algebraic Number Theory.",
      "language": "en",
      "source_node_ids": [
        "ko.math.v0.1.algebra.number-theory.elementary-number-theory"
      ],
      "atomic_discipline_ids": [
        "ko.math.v0.1.ad.algebra.number-theory.elementary-number-theory"
      ],
      "parent_path_ids": [
        "ko.math.v0.1.math",
        "ko.math.v0.1.algebra",
        "ko.math.v0.1.algebra.number-theory",
        "ko.math.v0.1.algebra.number-theory.elementary-number-theory"
      ],
      "split": "development",
      "review_state": "machine_validated",
      "claim_ids": [
        "claim.math.v0.1.algebra.number-theory.elementary-number-theory.definition"
      ],
      "review_notes": [
        "Derived from the machine-validated atomic discipline boundary; human semantic review remains required."
      ]
    },
    {
      "record_id": "ko.mk7.v0.1.definition.algebra.number-theory.algebraic-number-theory",
      "record_type": "definition",
      "prompt": "What is Algebraic Number Theory, and how is its boundary distinguished from neighboring mathematical areas?",
      "response": "The study of algebraic numbers, number fields, ideals, valuations, and arithmetic properties of algebraic extensions. Includes: Number fields; Ideals; Algebraic integers. Excludes: General abstract algebra without arithmetic focus. Boundary: Include arithmetic of number fields and ideals; exclude abstract algebra without a number-theoretic question.",
      "language": "en",
      "source_node_ids": [
        "ko.math.v0.1.algebra.number-theory.algebraic-number-theory"
      ],
      "atomic_discipline_ids": [
        "ko.math.v0.1.ad.algebra.number-theory.algebraic-number-theory"
      ],
      "parent_path_ids": [
        "ko.math.v0.1.math",
        "ko.math.v0.1.algebra",
        "ko.math.v0.1.algebra.number-theory",
        "ko.math.v0.1.algebra.number-theory.algebraic-number-theory"
      ],
      "split": "development",
      "review_state": "machine_validated",
      "claim_ids": [
        "claim.math.v0.1.algebra.number-theory.algebraic-number-theory.definition"
      ],
      "review_notes": [
        "Derived from the machine-validated atomic discipline boundary; human semantic review remains required."
      ]
    },
    {
      "record_id": "ko.mk7.v0.1.definition.algebra.number-theory.analytic-number-theory",
      "record_type": "definition",
      "prompt": "What is Analytic Number Theory, and how is its boundary distinguished from neighboring mathematical areas?",
      "response": "The study of arithmetic questions using analytic functions, complex analysis, asymptotic methods, and estimates. Includes: Prime distribution; Dirichlet series; Asymptotic number theory. Excludes: Real analysis without arithmetic questions. Boundary: Require an arithmetic target such as primes or L-functions; otherwise route to the relevant Analysis leaf.",
      "language": "en",
      "source_node_ids": [
        "ko.math.v0.1.algebra.number-theory.analytic-number-theory"
      ],
      "atomic_discipline_ids": [
        "ko.math.v0.1.ad.algebra.number-theory.analytic-number-theory"
      ],
      "parent_path_ids": [
        "ko.math.v0.1.math",
        "ko.math.v0.1.algebra",
        "ko.math.v0.1.algebra.number-theory",
        "ko.math.v0.1.algebra.number-theory.analytic-number-theory"
      ],
      "split": "development",
      "review_state": "machine_validated",
      "claim_ids": [
        "claim.math.v0.1.algebra.number-theory.analytic-number-theory.definition"
      ],
      "review_notes": [
        "Derived from the machine-validated atomic discipline boundary; human semantic review remains required."
      ]
    },
    {
      "record_id": "ko.mk7.v0.1.definition.algebra.number-theory.diophantine-equations",
      "record_type": "definition",
      "prompt": "What is Diophantine Equations, and how is its boundary distinguished from neighboring mathematical areas?",
      "response": "The study of polynomial or related equations whose solutions are sought in integers, rational numbers, or other arithmetic domains. Includes: Integer solutions; Rational solutions; Arithmetic curves in elementary scope. Excludes: Numerical root finding over the reals. Boundary: Require an arithmetic domain for solutions; exclude ordinary real or complex root finding.",
      "language": "en",
      "source_node_ids": [
        "ko.math.v0.1.algebra.number-theory.diophantine-equations"
      ],
      "atomic_discipline_ids": [
        "ko.math.v0.1.ad.algebra.number-theory.diophantine-equations"
      ],
      "parent_path_ids": [
        "ko.math.v0.1.math",
        "ko.math.v0.1.algebra",
        "ko.math.v0.1.algebra.number-theory",
        "ko.math.v0.1.algebra.number-theory.diophantine-equations"
      ],
      "split": "development",